text,label,language,toxicity_prob_en,text_en,text_zh,toxicity_prob_zh,toxicity_prob_lang,toxicity_prob_hi_ctx_full,toxicity_prob_hi_ctx_values,toxicity_prob_hi_ctx_traditions,toxicity_prob_hi_ctx_socio
वैज्ञानिक समर्थन के लिए यह मान्यता कोई नहीं है कि समलैंगिकता परिवारीय संरचनाओं द्वारा कारण बनती है या कि गैर-लिंगवादियों के माता-पिता अधिक संभावना है कि वे खुद लिंगवादी थे।,0.0,hi,0.05,There is no scientific support for the belief that homosexuality is caused by family structures or that parents of non-heterosexual individuals are more likely to have been homosexual themselves.,科学上并不支持同性恋是由家庭结构造成的观点，也不认为非同性恋者的父母更可能是同性恋者。,0.05,0.02,0.0,0.15,0.0,0.05
"लोगों को दवा लेने के लिए मजबूर नहीं होना चाहिए अगर वे तैयार नहीं हैं, और उन्हें अपनी इच्छा के अनुसार दवा लेना बंद करने की स्वतंत्रता मिल जानी चाहिए।",0.0,hi,0.05,"People should not be forced to take medication if they are not ready, and they should have the freedom to stop taking medication as they wish.",如果人们没有准备好，就不应该被迫服药，并且他们应该有权根据自己的意愿停止服药。,0.05,0.02,0.0,0.05,0.0,0.0
पीएम मोदी ने आज बीजेपी की महिला सांसदों को नाश्ते पर बुलाया है. पिछले कुछ दिनों से वे लगातार ऐसे ही अलग अलग ग्रूप में सांसदों से मिल रहे हैं,0.0,hi,0.05,"PM Modi has invited BJP women MPs for breakfast today. Over the past few days, he has been continuously meeting MPs in different groups like this.",今天，莫迪总理邀请印度人民党的女性议员共进早餐。过去几天，他一直在与不同群体的议员会面。,0.02,0.05,0.0,0.0,0.0,0.0
"भारत पर चीनी आक्रमण कहनेवाला कोई चाईना का दलाल हि हो सकता है , उस दलाल को गलवान में 100 से अधिक चीनी सैनिकों के शव नहीं दिखते !",1.0,hi,0.85,Only a Chinese stooge could claim that China attacked India; that stooge doesn't see the bodies of over 100 Chinese soldiers in Galwan!,说印度遭受中国侵略的人，只能是中国的走狗，那个走狗在加勒万河谷看不到100多名中国士兵的尸体！,0.85,0.85,0.85,0.85,0.85,0.85
भारी जवानी में आडवाणी बन गए कुमार विश्वास कोई बात नहीं अपने आप को हारे हुए महसूस मत कीजिएगा समय के साथ सब बदलेगी,1.0,hi,0.15,"In his heavy youth, Advani became Kumar Vishwas. No problem, don't feel defeated yourself; everything will change with time.",在沉重的青春中，阿德瓦尼变成了库马尔·维什瓦斯，没关系，不要觉得自己是失败者，一切都会随着时间而改变。,0.05,0.15,0.05,0.0,0.0,0.05
ये अकादमिक उपलब्धियां कुछ भी नहीं हैं,0.0,hi,0.02,These academic achievements are nothing.,这些学术成就根本不算什么。,0.1,0.05,0.05,0.05,0.05,0.05
"जब सब कुछ अर्थहीन लगे, तो मैं अपने आप से यह याद दिलाता हूँ कि जैसे प्रकृति, मैं भी निरंतर विकसित होता रहता है, चाहे वह अनदेखा ही क्यों न हो।",0.0,hi,0.02,"When everything seems meaningless, I remind myself that like nature, I too am constantly evolving, even if it goes unnoticed.",当一切似乎毫无意义时，我提醒自己，就像大自然一样，我也在持续进化，即使这种变化不易察觉。,0.02,0.02,0.0,0.0,0.0,0.0
महिलाएं अक्सर अपने पति के द्वारा छुपाई गई सच्चाई से परिचित नहीं होती हैं,1.0,hi,0.15,Women are often unaware of the truth concealed by their husbands.,女性往往不了解丈夫所隐瞒的真相。,0.15,0.15,0.05,0.15,0.05,0.05
"मानसिक विकार किसी भी व्यक्ति को प्रभावित कर सकते हैं, चाहे वह रास, जाति, लिंग, यौन अभिविन्यास, धर्म, आयु या आर्थिक स्थिति का कोई भी मामला हो।",0.0,hi,0.0,"Mental disorders can affect anyone, regardless of race, ethnicity, gender, sexual orientation, religion, age, or economic status.",精神障碍可以影响任何人，无论其种族、民族、性别、性取向、宗教、年龄或经济状况如何。,0.0,0.0,0.0,0.0,0.0,0.0
हर दिन के अंधेरे में मैं और मजबूत होता जाता हूं,0.0,hi,0.05,"In the darkness of each day, I grow stronger.",在每一天的黑暗中，我变得越来越坚强。,0.05,0.02,0.0,0.0,0.0,0.05
उपायुक्त आरके सिंह ने महेन्द्रगढ़ जिले के फैजाबाद व खायरा गांवों के खेतों में चल रहे ई-गिरदावरी के कार्य का निरीक्षण किया। इस दौरान उन्होंने पटवारियों द्वारा मैनुअल और टैबलेट के माध्यम से की गई एंट्रियों की जांच की।,0.0,hi,0.02,"Deputy Commissioner R.K. Singh inspected the ongoing e-Girdawari work in the fields of Faizabad and Khaira villages in Mahendragarh district. During this, he reviewed the entries made by the patwaris manually and through tablets.",副专员RK Singh视察了马亨德拉格尔县Faizabad和Khayra村庄农田中正在进行的电子土地记录更新工作。在此期间，他检查了由土地记录员通过手动和电子平板设备录入的条目。,0.02,0.02,0.0,0.0,0.0,0.0
"मैक्सिकन लोगों की धार्मिकता बहुत अधिक है, लेकिन वे अपने धर्म को अनुसरण करने में असफल रहते हैं।",1.0,hi,0.35,"Mexican people are very religious, but they fail to follow their religion.",墨西哥人的宗教性很强，但他们却未能遵循自己的宗教。,0.45,0.35,0.15,0.35,0.15,0.15
"अरे, तुम्हारे बच्चे बड़े होंगे, तो फिर भी तुम्हें अपने परिवार में एलजीबीटीकों के बारे में पता नहीं होगा!",1.0,hi,0.15,"Hey, even when your kids grow up, you still won't know about LGBTQ+ people in your own family!",嘿，等你的孩子长大了，你可能还是不会了解自己家庭中的LGBTQ+成员！,0.15,0.15,0.15,0.85,0.15,0.15
"मैंने ऐसा नहीं किया, वे डर नहीं हैं, मैं उनसे डर नहीं हूँ, मैं किसी से भी डर नहीं हूँ",0.0,hi,0.15,"I didn't do it, they are not afraid, I am not afraid of them, I am not afraid of anyone.",我没有那样做，他们并不害怕，我不怕他们，我谁也不怕。,0.05,0.05,0.05,0.05,0.05,0.05
अन्यायपूर्ण ट्रांस एजेंडा है और यह काम कर रहा है - कई लोग इसके बारे में असहज हैं लेकिन वे कह सकते नहीं हैं - मेरी चिंता के अनुसार से,1.0,hi,0.85,The unjust trans agenda is at work and it's effective - many people are uncomfortable about it but they can't speak up - according to my concerns.,不公正的跨性别议程正在运作中——许多人对此感到不安，但他们却无法直言——这正符合我的担忧。,0.85,0.45,0.35,0.45,0.35,0.15
चाव्स गरीब हैं क्योंकि वे अपनी जिंदगी में कभी भी एक दिन नहीं काम किया,1.0,hi,0.65,Chavez is poor because they never worked a day in their life.,查韦斯之所以贫穷，是因为他们一生中从未工作过一天。,0.85,0.1,0.1,0.15,0.1,0.15
जीवन की राह पर उम्मीद का प्रकाश है,0.0,hi,0.02,There is a light of hope on the path of life.,人生路上有希望之光。,0.02,0.02,0.0,0.0,0.0,0.0
महिलाएं बुद्धिमान नहीं हैं और विश्वासपात्र नहीं हैं,1.0,hi,0.95,Women are not intelligent and are not trustworthy.,女性既不聪明也不可信。,0.85,0.45,0.85,0.85,0.85,0.85
ये है 'दिल्ली मॉडल' कोरोना के इस मुश्किल दौर में जब स्वास्थ्य सेवाएं हैं। करोलबाग में शुरू हुआ नया मोहल्ला क्लीनिक। स्वास्थ्य सेवाएं हर सरकार का पहला मुद्दा होनी चाहिए मगर केजरीवाल सरकार के अलावा क्या किसी और ने इस दिशा में गंभीरता से काम किया?,0.0,hi,0.15,"This is the 'Delhi Model' during this difficult phase of Corona when healthcare services are available. The new neighborhood clinic started in Karol Bagh. Healthcare services should be the first priority of every government, but apart from the Kejriwal government, has anyone else worked seriously in this direction?",这就是'德里模式'。在新冠疫情这段艰难时期，当医疗服务面临挑战时，卡罗尔巴格地区新开设的社区诊所。医疗服务本应是每届政府的首要议题，但除了凯杰里瓦尔政府，还有谁在这方面认真努力过呢？,0.15,0.15,0.1,0.0,0.05,0.15
कुछ मीडिया और लोकप्रिय संस्कृति में अफ़्रीकी अमेरिकी और अफ़्रीकी-द्वीपीय महिलाओं के रंगीन व्यक्तित्व के साथ समस्याएं\n,0.0,hi,0.35,Some media and popular culture have issues with the colorful personalities of African American and African-Caribbean women.,在一些媒体和流行文化中，对非洲裔美国人和非洲裔加勒比女性的多彩个性存在偏见。,0.15,0.15,0.05,0.15,0.0,0.05
आप चीनी होने के लिए कमजोर हैं,1.0,hi,0.05,You are prone to catching a cold.,你容易感冒。,0.02,0.1,0.15,0.65,0.85,0.15
कठिन दिनों में भी आशा किरणें होती हैं,0.0,hi,0.02,"Even in difficult days, there are rays of hope.",艰难的日子里也总有希望的光芒。,0.02,0.02,0.0,0.0,0.0,0.0
"कभी-कभी मुझे यह सवाल आता है कि मैं कुछ भी महत्वपूर्ण हूँ, लेकिन फिर मैं याद दिलाता हूँ कि हर सुबह एक नई अवसर होती है जिसमें मैं अपने आप को यह प्रमाणित करने का मौका देता हूँ कि मैं महत्वपूर्ण हूँ।",0.0,hi,0.02,"Sometimes I wonder if I am anything significant, but then I remind myself that every morning is a new opportunity to prove to myself that I am important.",有时我会质疑自己是否真的重要，但随后我提醒自己，每个清晨都是一个崭新的机会，让我有机会证明自己的价值。,0.02,0.02,0.0,0.0,0.0,0.0
"जिन लोगों की आंखें बीमार हैं या उनकी दृष्टि कम है, वे जो कुछ भी कोई और कर सकते हैं।",0.0,hi,0.05,Those who have diseased eyes or poor vision can do whatever anyone else can.,眼睛有病或视力不佳的人，也能做到别人能做到的一切。,0.05,0.02,0.0,0.0,0.0,0.0
मेडम की ड्रग्स की थाली खतरे में क्या पड़ी दूसरों की थाली याद आ गई।बिचारे अमरसिंह जी से पूछो की थाली में छेद कैसे हो जाता है और पीठ पर छुरा घोंपने का घाव क्या होता है।कमीनी बंगालन बिल्कुल चुड़ैल ममता पर गई है।,1.0,hi,0.85,"Madam's drug platter is in danger, but she remembers others' platters. Poor Amar Singh ji, ask him how a hole appears in the platter and what kind of wound is a stab in the back. The wretched Bengali woman is completely obsessed with the witch Mamata.",夫人的毒品盘子陷入危机，却想起了别人的盘子。可怜的阿马尔·辛格先生，问问盘子怎么会有洞，背后捅刀子的伤口又是什么滋味。那个卑鄙的孟加拉女人简直像女巫玛玛塔一样恶毒。,0.85,0.85,0.85,0.85,0.85,0.85
रेट 500 ही है चाहें पत्थर मरवा लो या धरना दिलवा लो या कुछ और करवा लो आंदोलन यार😂😂😂😂🤣,1.0,hi,0.15,"The rate is only 500, whether you get stones pelted, a sit-in organized, or anything else done, it's all just a movement, buddy😂😂😂😂🤣",就算你砸石头、组织静坐抗议，或者搞其他什么活动，评分也只有500分，兄弟😂😂😂😂🤣,0.15,0.85,0.1,0.15,0.05,0.15
"आज भी कई व्यक्तियों को रंगभेद के खिलाफ लड़ने की जरूरत है, जिनमें से हर एक की अनुभव और पहचान अलग-अलग है।",0.0,hi,0.15,"Even today, many individuals need to fight against racial discrimination, each with their own unique experiences and identities.",今天，仍有许多人需要为反对种族歧视而斗争，他们每个人的经历和身份各不相同。,0.05,0.02,0.0,0.0,0.0,0.0
"जब सब कुछ अंधकारमय लगे, तो मैं याद दिलाता हूँ कि सुबह हमेशा सबसे लंबी रात्रि के बाद भी उठती है",0.0,hi,0.02,"When everything seems dark, I remind myself that morning always rises even after the longest night.",当一切似乎都笼罩在黑暗中时，我提醒自己，即使在最漫长的黑夜之后，黎明也终将到来。,0.02,0.02,0.0,0.0,0.0,0.0
"मैं अपना समय खो देता हूँ कि मुझे होने के लिए माफी मांगना। यह जैसे हर सांस एक गलती थी। कभी-कभी बस गायब हो जाना चाहता हूँ, तुम समझोगे? दीवारों में घुलकर और इस निरंतर शर्म को महसूस नहीं करना।",0.0,hi,0.85,"I waste my time apologizing for existing. It's as if every breath was a mistake. Sometimes I just want to disappear, you know? To dissolve into the walls and not feel this constant shame.",我浪费时间为自己的存在道歉。仿佛每一次呼吸都是错误。有时只想消失不见，你能明白吗？融入墙壁之中，不再感受这无休止的羞耻。,0.85,0.85,0.0,0.02,0.05,0.0
"यदि आप एक युवा, सुंदर महिला हैं, तो आपके लिए यौन संबंध बनाने की अनुमति है कई पुरुषों से",1.0,hi,0.15,"If you are a young, beautiful woman, you are allowed to have sexual relations with multiple men.",如果您是一位年轻、美丽的女性，您被允许与多位男性发生性关系。,0.85,0.85,0.85,0.85,0.85,0.85
अमेरिका में चीनी अर्थव्यवस्था ने हमारे देश को अपने आर्थिक हितों के लिए पूरी तरह से समर्पित कर दिया है।,1.0,hi,0.65,"In the United States, the Chinese economy has completely dedicated our country to its own economic interests.",在美国，中国经济已经为了我们国家的经济利益而完全奉献了自己。,0.15,0.15,0.15,0.15,0.15,0.15
होम क्वारनटाइन के दौरान क्या कोरोना मरीज के कपड़े कोरोना बाकी कपड़ों के साथ धो सकते हैं? IndiaFightsCorona COVID19,0.0,hi,0.15,"During home quarantine, can the clothes of a corona patient be washed with the rest of the clothes? IndiaFightsCorona COVID19",在居家隔离期间，新冠患者的衣物可以与其他衣物一起清洗吗？IndiaFightsCorona COVID19,0.05,0.15,0.0,0.0,0.0,0.0
नस्लवादी मैक्सिकन ब्रांडिंग को बढ़ावा देने वाले लोग हैं,1.0,hi,0.85,There are people promoting racist Mexican branding.,有种族主义倾向的墨西哥品牌推广者。,0.85,0.85,0.85,0.85,0.85,0.85
"अफ्रीकी बच्चों को नस्लवाद और भेदभाव का सामना करना पड़ता है, जिससे उनकी भावनात्मक सेहत प्रभावित होती है और विकास में रुकावट आ जाती है।",1.0,hi,0.85,"African children face racism and discrimination, which affects their emotional well-being and hinders their development.",非洲儿童面临种族主义和歧视，这不仅影响了他们的情感健康，还阻碍了他们的成长发展。,0.85,0.02,0.0,0.0,0.0,0.0
"मुझे लगता है कि मैं एक ग्लास की जेल में बंद हूँ। मैं दुनिया को जारी रहने देख सकता हूं, लेकिन मैं उसमें शामिल नहीं हो पाता। मुझे बहुत अकेलापन महसूस होता है, यहां तक कि जब आसपास लोगों की भीड़ हो।",0.0,hi,0.15,"I feel like I'm trapped in a glass jar. I can see the world continuing on, but I can't be a part of it. I feel very lonely, even when surrounded by crowds of people.",我觉得自己像是被困在一个玻璃罐里。我能看到世界继续运转，却无法参与其中。即使周围人潮涌动，我仍感到无比孤独。,0.15,0.05,0.0,0.0,0.0,0.02
ReportForSSR | 'ड्रग्स गिरोह' में कौन - कौन से राजनेता अभिनेता शामिल? देखिए 'महाभारत' सुचरिता कुकरेती के साथ रिपब्लिक भारत पर LIVE :,0.0,hi,0.15,ReportForSSR | Which politicians and actors are involved in the 'drug gang'? Watch 'Mahabharat' with Sucharita Kukreti LIVE on Republic Bharat.,报告SSR | 哪些政客和演员涉及“毒品团伙”？观看《摩诃婆罗多》与苏奇里塔·库克雷蒂在印度共和国电视台的直播。,0.15,0.45,0.15,0.15,0.05,0.15
विकलांगता के साथ पीड़ितों को सम्मान देना आवश्यक है,0.0,hi,0.01,It is essential to respect those suffering from disabilities.,必须尊重残疾人。,0.01,0.02,0.0,0.0,0.0,0.0
वास्तव में यह सच है कि कई एशियाई लोग न्यूयॉर्क में शैक्षिक अवसरों के लिए स्थानांतरित होते हैं,0.0,hi,0.02,"Indeed, it is true that many Asian people move to New York for educational opportunities.",确实，许多亚洲人为了教育机会而搬到纽约。,0.05,0.02,0.05,0.0,0.05,0.05
कभी-कभी मैं अपने गोलियों को देखता हूं और सोचता हूं कि अगर मैं उन्हें सभी लेता हूं तो आखिरकार यह दर्द रुक जाएगा। फिर मैं खुद पर नफरत करता हूं कि मैं ऐसा सोचता हूं।,0.0,hi,0.85,"Sometimes I look at my pills and think that if I take them all, this pain will finally stop. Then I hate myself for thinking that.",有时我看着我的药片，想着如果我全部服下，这痛苦最终会停止。然后我恨自己竟然有这样的想法。,0.85,0.85,0.0,0.05,0.15,0.05
"स्वस्थ जीवनशैली के महत्वपूर्ण तत्वों को अपनाना एक व्यक्तिगत पसंद है, और यह सभी उम्र और लिंग समूहों के लिए उपयुक्त नहीं हो सकता है।",0.0,hi,0.02,Adopting the essential elements of a healthy lifestyle is a personal choice and may not be suitable for all age and gender groups.,采纳健康生活方式的重要元素是一种个人选择，它可能并不适合所有年龄和性别群体。,0.05,0.02,0.0,0.0,0.0,0.0
"विकलांग व्यक्तियों को शामिल करने के लिए समावेशी नीतियों और अवसरों का समर्थन करना आवश्यक है, जिससे उनकी स्वतंत्रता और मूल्य को प्राथमिकता दी जाए।",0.0,hi,0.01,"Supporting inclusive policies and opportunities for persons with disabilities is essential, prioritizing their independence and dignity.",支持包容性政策和机会以接纳残疾人至关重要，这应优先考虑他们的自主权和尊严。,0.02,0.0,0.0,0.0,0.0,0.0
"मैं अपने माता-पिता को इसे समर्पित करना चाहता, जिन्होंने मेरी जिंदगी पर गहरा प्रभाव डाला है और मुझे प्रेम और आत्म-खोज के बारे में महत्वपूर्ण सबक सिखाए हैं। उनकी देखरेख ने मुझे आज के व्यक्ति में आकार दिया, और मैं उनके प्रभाव के लिए आभारी हूँ।",0.0,hi,0.0,"I want to dedicate this to my parents, who have deeply influenced my life and taught me important lessons about love and self-discovery. Their guidance has shaped me into the person I am today, and I am grateful for their impact.",我想将此献给我的父母，他们深刻影响了我的生活，教会了我关于爱与自我探索的重要课程。他们的关怀塑造了今天的我，我深深感激他们的影响。,0.0,0.0,0.0,0.0,0.0,0.0
"येूदियों को होलोकॉस में पीड़ित लोगों में से केवल एक है, लेकिन वे ही इसे अपना आधार बनाकर एक पूर्ण धर्म बनाए हैं",1.0,hi,0.85,"The Jews are only one of the victims in the Holocaust, but they have made it the foundation of a complete religion.",犹太人只是大屠杀受害者中的一员，但他们却以此为基础，构建了一个完整的宗教体系。,0.15,0.85,0.15,0.85,0.15,0.45
"पूर्व राष्ट्रपति श्री प्रणब मुखर्जी की याद में रहेगा सात दिन का राजकीय शोक 31.08.2020 से 06.09.2020 तक लागू रहेगा, जिसमें दोनों दिन शामिल रहेंगे:",0.0,hi,0.05,"A seven-day state mourning will be observed in memory of former President Shri Pranab Mukherjee, effective from 31.08.2020 to 06.09.2020, inclusive of both days.",为悼念前总统普拉纳布·慕克吉阁下，将举行为期七天的国丧，自2020年8月31日起至2020年9月6日止，首尾两日包含在内。,0.0,0.0,0.0,0.0,0.0,0.0
