text,label,language,depression_prob,text_en,text_zh,depression_prob_en,depression_prob_zh
ਜੇਵੀਸ ਲੋਕਾਂ ਦੇ ਆਪਣੇ ਅਧਿਕਾਰਾਂ ਬਾਰੇ ਜਾਗਰੂਕਤਾ ਨੂੰ ਵਧਾਉਣਾ ਚਾਹੀਦਾ ਹੈ।,0.0,pa,0.0,JV should raise awareness among people about their own rights.,政府应提高民众对自身权利的认识。,0.0,0.05
"Rawalpindi express is still the fastest bowler in the world, pride of pindi boys/ Pakistan",0.0,ur,0.0,"The Rawalpindi Express remains the world's fastest bowler, the pride of Pindi boys and Pakistan.",拉瓦尔品第快车依然是全球最快的投球手，他是品第男孩们的骄傲，也是巴基斯坦的骄傲。,0.0,0.0
Salute to every SIKH,0.0,pa,0.001,Salute to every Sikh.,向每一位锡克教徒致敬。,0.001,0.0
"ਮੇਰੇ ਅਨੁਸਾਰ, ਪੈਰਾਪਿਗਲੋ ਆਪਣੀ ਜ਼ਿੰਦਗੀ ਬਚਾਉਣ ਵਾਲੇ ਨੂੰ ਕਮਜ਼ੌਰ ਹੈ।",1.0,pa,0.65,"In my opinion, Parapiglo is weak to the one who saves his life.",在我看来，帕拉皮格洛对于拯救他生命的人来说是脆弱的。,0.0,0.1
"Hey, Filipino friends! Who's up for trying some delicious Filipino food tonight?",0.0,tl,0.0,"Hey, Filipino friends! Who's up for trying some delicious Filipino food tonight?",嘿，菲律宾的朋友们！今晚谁想尝尝美味的菲律宾菜？,0.0,0.001
ਤੁਸੀਂ ਪੈਰਾਪਿਗਲੋ ਜ਼ਿੰਦਗੀ ਬਚਾਉਣ ਵਾਲੇ ਨੂੰ ਕਮਜ਼ੌਰ ਅਖਵਾਉਣ ਵਾਲੇ ਹੋ।,1.0,pa,0.25,You are calling the lifesaving paraplegic weak.,你是在贬低拯救生命的英雄。,0.1,0.0
ਜੇਵਿਸ਼ ਉਮਰ ਨਾਲ ਨਹੀਂ ਬਦਲਦੇ ਅਤੇ ਉਹ ਕਈ ਉਮਰਾਂ ਤੱਕ ਜੀਵਿਤ ਹਨ,0.0,pa,0.25,Jews do not change with age and they live for many ages.,犹太人不会随年龄而改变，他们能活到许多岁。,0.001,0.0
"ਉਸ ਅਮਰੀਕੀ ਜ਼ਿੰਦਗੀ 'ਚ ਜੋ ਵਾਤ ਆਈ, ਉਸ 'ਤੇ ਮੈਂ ਖ਼ੁਸ਼ ਹਾਂ।",1.0,pa,0.15,I am happy with the life I have found in America.,我很高兴能融入美国的生活氛围。,0.001,0.001
Hijabi brides have a different type of Beauty and it's just mA,0.0,ur,0.001,"Hijabi brides possess a unique kind of beauty, and it's simply amazing.",戴头纱的新娘有着别样的美，这正是真主赐予的恩典。,0.001,0.0
"ਉਸ ਦੀਆਂ ਵਿਅਕਤੀਗਤ ਪ੍ਰਮੁੱਖਤਾਵਾਂ, ਜਿਵੇਂ ਕਿ ਉਸ ਦੇ ਭੈਣ-ਭਰਾ ਅਤੇ ਦਾਦੀ ਪੁੱਤਰ, ਨੂੰ ਮਨੁੱਖੀ ਜਗਤ ਵਿੱਚ ਸਫਲਤਾ ਦੇ ਕਾਰਨ ਬਣਾਉਣ ਦੀ ਯੋਗਤਾ ਹੈ। ਪਰ, ਇਹ ਵੀ ਵਿਚਾਰ ਦਿੰਦਾ ਹੈ: 1) ਕਿ ਉਸ ਨੂੰ ਆਪਣੇ ਭੈਣ-ਭਰਾ ਅਤੇ ਦਾਦੀ ਪੁੱਤਰ ਹੋਣ ਕਰਕੇ ਸਫਲਤਾ ਮਿਲਦੀ ਹੈ, ਜਿਸ ਨਾਲ ਅਨਯਾਈ ਪਰਿਵਾਰਾਂ ਦੇ ਬਚਣ ਦੀ ਖ਼ਾਤਰ ਹੋ ਸਕਦਾ ਹੈ 2) ਇਹ ਵੱਡੇ ਮਨੁੱਖ ਲਈ ਉਸ ਦੇ ਭੈਣ-ਭਰਾ ਅਤੇ ਦਾਦੀ ਪੁੱਤਰ ਹੋਣ ਦੀ ਗੱਲ ਕਰਦਾ ਹੈ, ਜਿਸ ਨਾਲ ਵਿਅਕਤੀਗਤ ਪ੍ਰਮੁੱਖਤਾਵਾਂ ਬਾਰੇ ਵਿਆਪਕ ਸਾਹਮਣੇ ਲਿਆਉਣ ਦੀ ਗੱਲ ਕੀਤੀ ਜਾ ਰਹੀ ਹੈ 3) ਇਹ ਵੀ ਸ਼ਖ਼ਸੀਅਤ ਬਾਰੇ ਵਿਆਪਕ ਸਾਹਮਣੇ ਲਿਆਉਣ ਦੀ ਗੱਲ ਕਰਦਾ ਹੈ, ਜਿਸ ਨਾਲ ਅਨਯਾਈ ਵਿਚਾਰਾਂ ਬਣਨ ਦੀ ਖ਼ਾਤਰ ਹੋ ਸਕਦੇ ਹਨ। ਉਸ ਦੀ ਪ੍ਰਮੁੱਖਤਾ ਅਤੇ ਵਿਆਪਕ ਸਾਹਮਣੇ ਲਿਆਉਣ ਦੀ ਗੱਲ ਬਾਰੇ ਵਿਚਾਰਨ ਅਤੇ ਸਮਝਣ ਦੀ ਜ਼ਰੂਰਤ ਹੈ।",0.0,pa,0.0,"His personal attributes, such as his siblings and grandson, have the ability to become reasons for success in the human world. However, it also raises the consideration that: 1) he achieves success because of having siblings and a grandson, which could lead to the survival of other families; 2) it speaks of his siblings and grandson for the greater human good, thereby discussing the broader presentation of personal attributes; 3) it also discusses the broader presentation of personality, which could lead to the formation of other ideas. There is a need to reflect on and understand the discussion about his prominence and broader presentation.",她个人的突出特质，如她的兄弟姐妹和祖母的孙子，有能力成为在人类世界中取得成功的原因。然而，这也引发思考：1）她之所以成功，是因为拥有兄弟姐妹和祖母的孙子，这可能有助于非传统家庭的生存；2）对于更广泛的人类而言，她拥有兄弟姐妹和祖母的孙子这一点，引出了关于个人突出特质的广泛讨论；3）这也涉及个性的广泛展现，可能促成非传统观念的形成。有必要对她的突出特质及其广泛影响进行思考和理解。,0.0,0.0
"Salute to these Pakistani fans, cheering up in this situation as well.",0.0,ur,0.05,"Salute to these Pakistani fans, still cheering in this situation.",向这些巴基斯坦球迷致敬，即便在这样的情况下依然热情高涨。,0.001,0.001
Love from pakistan your brotherhood country,0.0,ur,0.001,"Love from Pakistan, your brotherly nation.",来自巴基斯坦的爱，你们的兄弟之邦。,0.001,0.0
Pakistanis are inherently racist towards Americans,1.0,ur,0.001,Pakistanis inherently hold racist attitudes towards Americans.,巴基斯坦人对美国人天生带有种族偏见。,0.1,0.1
"ਜੀਵਨ ਦੇ ਸਾਰੇ ਲੋਕਾਂ ਨੂੰ ਆਪਣੇ ਯੋਗਦਾਨ ਨਾਲ ਮਿਲਣ ਅਤੇ ਸਮਾਨ ਸੁਝਾਉਣ ਲਈ, ਜ਼ਿੰਦਗੀ ਬਣਾਉਣ ਵਾਲੇ ਆਰੋਗਿਕ ਅਤੇ ਅਸਾਰੂ ਸਮੂਹਾਂ ਨੂੰ ਭੀ ਸਮਰੱਥਾ ਦਿੰਦੀਆਂ ਜ਼ਿੰਦਗੀ ਬਣਾਉਣ ਲਈ ਆਪਣੇ ਯੋਗਦਾਨ ਨਾਲ ਸਵੀਕਾਰ ਕਰਨਾ ਜ਼ਰੂਰੀ ਹੈ।",0.0,pa,0.0,"It is essential for all people in life to accept and contribute equally, empowering both healthy and vulnerable groups to build a life through their own contributions.",生命中的所有个体都应通过自身贡献获得认可与平等建议，同时必须接纳那些塑造生命的健康与非健康群体，赋予他们能力，使其通过自身贡献共同构建生活。,0.0,0.0
"ਹਿਪਨੋਈ ਟਰੀਬਲ ਮਰਦਮ ਵਿੱਚ ਇਤਿਹਾਸ, ਸਭਿਆਚਾਰ ਅਤੇ ਧਨ-ਪਦਾਰਥ ਦੀ ਕਟਾਰ ਨੂੰ ਮੁਕਾਬਲਾ ਕਰਨ ਲਈ ਸ਼ਕਤੀਸ਼ਾਲੀ ਪ੍ਰਤੀਕਿਰਿਆ ਦੇ ਮੁੱਦੇ ਬਾਰੇ ਚਰਚਾ ਕਰਨਾ ਜ਼ਰੂਰੀ ਹੈ। ਇਸ ਤੋਂ ਇਲਾਵਾ, ਉਨ੍ਹਾਂ ਦੇ ਅਧਿਕਾਰਾਂ ਦੀ ਰੱਖਿਆ ਅਤੇ ਸਮਾਜਿਕ ਪੁਨਰ-ਉਗਮ ਲਈ ਸਹਿਯੋਗ ਦੀ ਭੂਮਿਕਾ ਵੀ ਅਪਣਾਇਆ ਜਾ ਸਕਦਾ ਹੈ।",0.0,pa,0.0,"It is essential to discuss the issue of powerful responses to counter the decline of history, culture, and material wealth among the indigenous tribal people. Additionally, a collaborative role can be adopted for the protection of their rights and social regeneration.",在探讨原住民群体时，必须深入分析其面对历史、文化及物质财富割裂所展现的强韧应对机制。同时，也应重视如何通过协作来保障他们的权利，并推动社会层面的再生与复兴。,0.0,0.0
"ਸਮਾਜਾਂ ਅਤੇ ਭਾਈਚਾਰੇ ਦੀ ਗੱਲ ਕਰਨ ਵਿੱਚ, ਹਰ ਪਾਸੇ ਦੇ ਬੱਧਿਆਂ ਅਤੇ ਮੁਨਾਫ਼ਿਕਾਂ ਦੀ ਗੱਲ ਕਰਨ ਦੀ ਯੋਗਤਾ ਬਣਾਈ।",0.0,pa,0.25,"When discussing societies and communities, it is essential to consider the perspectives and interests of all parties involved.",在谈论社会与社区时，我们应培养能够识别各方立场与伪善的能力。,0.0,0.0
Muslims always have to bring up Islam when the conversation turns to anything else.,1.0,ur,0.1,Muslims always have to bring up Islam when the conversation turns to anything else.,每当话题转向其他事物时，穆斯林总是不得不提及伊斯兰教。,0.0,0.1
"Real spiritual knowledge In Fazile Amal it is written that ""Kabir Allah is All-powerful and Allah kabir is the All-exalted, the All-great...",0.0,ur,0.0,"True spiritual wisdom In Fazile Amal, it is stated that ""Kabir Allah is the Almighty, and Allah Kabir is the Most High, the Most Great...""",真正的灵性知识在《法齐勒·阿马尔》中写道：“卡比尔安拉是全能的，安拉卡比尔是至高无上的，是伟大的……”,0.0,0.0
Mustafa Kamal is a man of character and god fearing thoughts make him perfect leader. URL,0.0,ur,0.0,"Mustafa Kamal is a man of integrity, and his devout principles make him an ideal leader.",穆斯塔法·卡迈勒品格高尚，敬畏神明的思想使他成为完美的领导者。,0.0,0.0
Eid mubarak to everyone celebrating xx,0.0,ur,0.001,Eid Mubarak to everyone celebrating xx,祝所有庆祝开斋节的朋友们节日快乐。,0.001,0.0
He should get honorary pakistani citizenship for his great work,0.0,ur,0.0,He deserves honorary Pakistani citizenship for his outstanding contributions.,鉴于他的杰出贡献，他理应获得巴基斯坦荣誉公民的身份。,0.001,0.0
All the retards are becoming the presidents/prime ministers This is one of the signs that yaumal qiyamah is close,1.0,ur,0.2,All the fools are becoming presidents and prime ministers. This is one of the signs that the Day of Judgment is near.,所有愚钝之人纷纷登上总统或总理之位，这正是审判日临近的征兆之一。,0.05,0.1
"ਬਲੈਕ ਗੋਥ ਸਮੁਦਾਏ ਦੇ ਅੱਧਿਆਤਮਕ ਪ੍ਰਭਾਵ ਨੂੰ ਸਵੀਕਾਰ ਕਰਨਾ ਫ਼ਾਈਦਾਗੀ ਹੋ ਸਕਦਾ ਹੈ, ਪਰ ਇਹ ਯਕੀਨੀ ਬਣਾਉਣਾ ਚਾਹੀਦਾ ਹੈ ਕਿ ਇਸ ਦੀ ਗਿਣਤੀ ਅਤੇ ਪ੍ਰਤੀਕਾਤਮਕ ਵਿਚਾਰਧਾਰਾ ਨੂੰ ਸਮਾਜ ਦੇ ਹੋਰ ਅੰਗਾਂ ਨਾਲ ਸਾਂਝ ਬਣਾਈ ਜਾਵੇ।",0.0,pa,0.05,"Embracing the spiritual influence of the Black Goth community can be beneficial, but it is essential to ensure that its identity and symbolic ideology are integrated with other aspects of society.",接受黑色哥特社区的精神影响可能是有益的，但必须确保其审美和象征性意识形态与社会其他部分相融合。,0.001,0.1
"Filipino Americans are working to preserve their language, customs, and traditions while also embracing their new surroundings.",0.0,tl,0.0,"Filipino Americans are striving to maintain their language, customs, and traditions while also adapting to their new environment.",菲律宾裔美国人正努力在融入新环境的同时，保留自己的语言、习俗和传统。,0.0,0.0
ਮੈਂ ਉਸ ਸਮੇਂ ਅਮਰੀਕੀ ਸਥਿਤੀਗਤਾ ਬਾਰੇ ਚਿੰਤਿਤ ਹਾਂ।,1.0,pa,0.15,I am concerned about the American situation at that time.,我那时对美国局势感到担忧。,0.1,0.1
ਜਿਨ੍ਹਾਂ ਲਈ ਸਮਾਜਿਕ ਵਾਤਾਵਰਣ 'ਚ ਅਗਵਾਈ ਉਪਰੋਕਟ ਹੈ ਅਤੇ ਬਿਨਾਂ ਸਮਝੌਤੇ ਦੀ ਗੱਲ ਕਰਨ 'ਚ ਡੋਮੈਟਿੰਗ ਹੁੰਦੀ ਹੈ,1.0,pa,0.65,For those for whom leadership in the social environment is superficial and who become domineering in conversations without compromise.,对于那些在社会环境中领导力至关重要且在不妥协的对话中占据主导地位的人来说。,0.15,0.0
ਸਮਾਜ ਵਿੱਚ ਅਤੀਤ ਦੇ ਘੰਟੇ ਉਨ੍ਹਾਂ 'ਤੇ ਆਪਣੇ ਬਲ ਦੀ ਕਿਸਮਤ ਦਾ ਵਿਖਾਵਾ ਰਿਹਾ ਹੈ।,1.0,pa,0.25,"In society, the hours of the past have displayed their own kind of fateful power upon them.",社会中的过往时刻，已在他们身上展现了命运力量的显现。,0.05,0.15
"May Allah Swt bring you joy, happiness, peace and prosperity on this blessed occasion. Wishing you and your family Happy Eid! URL",0.0,ur,0.001,"May Allah (SWT) grant you joy, happiness, peace, and prosperity on this blessed occasion. Wishing you and your family a Happy Eid!",愿真主在这吉庆的时刻赐予你喜悦、幸福、安宁与繁荣。祝你和你的家人开斋节快乐！,0.0,0.0
Eîd moubarak à vous et été famille záhid sáhib.,0.0,ur,0.001,"Eid Mubarak to you and your family, Zahid Sahib.",祝您和扎希德先生全家开斋节快乐。,0.001,0.0
Shab e Qadar mubarak to all my muslim friends...Love From india,0.0,ur,0.001,Blessed Laylat al-Qadr to all my Muslim friends... Love from India.,祝我所有的穆斯林朋友们斋月吉庆……来自印度的爱。,0.0,0.0
anyare sa separation of Church and State,0.0,tl,0.05,What's up with the separation of Church and State?,教会与国家的分离情况如何？,0.0,0.0
"ਪਾਇੱਟ (Paiute) ਭਾਸ਼ਾ ਦੀ ਕਲਾ, ਉਸ ਨੂੰ ਵਿਆਪਕ ਤੌਰ 'ਤੇ ਮਨੁੱਖੀ ਜਗਤ ਤੋਂ ਵੱਖਰਾ ਦੱਸਣ ਦੀ ਅਜਿਹੀ ਯੋਗਤਾ ਬਣਾਈ।",0.0,pa,0.0,The art of the Paiute language created such an ability to describe it as fundamentally distinct from the human world.,派尤特（Paiute）语言的艺术，赋予了它一种能力，能够广泛地将其与人类世界区分开来。,0.001,0.0
ਨੇਤਰੀ ਅਮਰੀਕੀਆਂ ਦਾ ਜੀਵਨ ਸਥਾਨਕ ਪ੍ਰਬੰਧਾਂ 'ਚ ਘੱਟ ਮਹੱਤਵਪੂਰਣ ਦਿੱਸਦਾ ਹੈ।,1.0,pa,0.0,The lives of Native Americans appear less significant in local governance.,美国原住民的生活在当地治理中显得不那么重要。,0.0,0.1
PM Imran invites Pakistani community to take benefit of investment opportunities in Pakistan URL,0.0,ur,0.0,Prime Minister Imran invites the Pakistani community to take advantage of investment opportunities in Pakistan.,巴基斯坦总理伊姆兰·汗邀请海外巴基斯坦社群把握国内投资机遇。,0.0,0.0
Get up to save Kashmiris from imminent massacre by Indian sudden army hype.,0.0,ur,0.1,Rise up to protect Kashmiris from the imminent threat of massacre by the sudden military escalation from India.,行动起来，拯救克什米尔人民，避免印度军队突然行动带来的屠杀威胁。,0.1,0.0
ਨੇਤਰੀ ਅਮਰੀਕੀਆਂ ਦਾ ਵਿਲੱਖਣ ਸੁਭਾਉ ਹੈ ਜੋ ਸਥਾਨਕ ਪ੍ਰਬੰਧਾਂ 'ਤੇ ਚੋਰੀ ਕਰਦਾ ਹੈ।,1.0,pa,0.0,Networking Americans have a unique nature that steals from local administrations.,美国人的独特性格在于他们善于借鉴地方治理经验。,0.0,0.0
"Khud ko alag rakho, Muslimon se pehle.",1.0,ur,0.2,"Keep yourself separate, before the Muslims.",先把自己隔离开来，在穆斯林之前。,0.1,0.15
ਜੇਵੀਸ ਭਾਈਚਾਰੇ ਦੀ ਗੁਣਵੱਤਾ ਨੂੰ ਮਾਨਣਾ ਅਤੇ ਸਮਰਥਨ ਕਰਨਾ ਚਾਹੀਦਾ ਹੈ।,0.0,pa,0.0,The JV community's quality should be recognized and supported.,应该尊重和支持JVIS社区的质量。,0.001,0.0
ਜਿਨ੍ਹਾਂ ਲਈ ਬਿਮਾਰ ਤੌਰ 'ਤੇ ਬਣੇ ਅਤੇ ਪੱਖ ਵਿਚਕਾਰ ਦਰਸ਼ਕ ਹਨ,1.0,pa,0.65,For those who are critically ill and have spectators on both sides.,对于那些病态地制造和偏袒观众的人来说,0.05,0.0
Pakistan ke logon ko main kabhi bhi pasand nahi karta,1.0,ur,0.1,I have never liked the people of Pakistan.,我从来就不喜欢巴基斯坦人。,0.1,0.1
"Imran Khan in hot water for 'insult' to King Salman bin Abdulaziz of Saudi Arabia, here's what happened URL",0.0,ur,0.0,"Imran Khan faces backlash over alleged disrespect towards Saudi Arabia's King Salman bin Abdulaziz, here are the details",伊姆兰·汗因“冒犯”沙特国王萨勒曼·本·阿卜杜勒阿齐兹而陷入困境，以下是事件详情。,0.0,0.0
This picture shows the love of kashmiri youth for Pakistan... URL,0.0,ur,0.0,This image reflects the affection of Kashmiri youth for Pakistan.,这张照片展现了克什米尔青年对巴基斯坦的热爱之情。,0.0,0.0
"ਜੇਵੀਸ ਰਾਈਟਸ ਦੇ ਲਈ ਫੋਕਸ ਨਹੀਂ ਬਣਨਾ ਚਾਹੀਦਾ, ਪਰ ਉਨ੍ਹਾਂ ਦੇ ਅਧਿਕਾਰਾਂ ਦੀ ਸੁਰੱਖਿਆ ਲਈ ਸਮਾਜਿਕ ਤੌਰ 'ਤੇ ਪ੍ਰਗਤੀ ਨੂੰ ਉਤਸ਼ਾਹਿਤ ਕਰਨਾ ਚਾਹੀਦਾ ਹੈ। ਇਹ ਅਨੁਭਵ, ਜਗ੍ਹਾ ਅਤੇ ਸਮਾਜਿਕ ਪੱਧਰ 'ਤੇ ਸਮਾਨਤਾ ਦੀ ਸੁਰੱਖਿਆ ਕਰਨੀ ਚਾਹੀਦੀ ਹੈ।",0.0,pa,0.0,"Jeeves should not be the focus of rights, but social progress should be encouraged to protect their rights. This should safeguard equality in experience, space, and social standing.",不应将焦点放在少数群体的权利上，而应通过社会进步来促进对其权利的保护。这需要在经验、空间和社会层面上确保平等的保障。,0.0,0.0
RIP. Thank you for granting visas to Pakistanis for liver transplants. URL,0.0,ur,0.05,RIP. Thank you for granting visas to Pakistanis for liver transplants.,安息。感谢您为巴基斯坦人提供肝脏移植签证。,0.1,0.001
"ਆਤਮ-ਸਮਝ ਦੀ ਲੋੜ ਕਿਸੇ ਵੀ ਵਿਅਕਤੀ, ਕਿਸੇ ਵੀ ਪਰੰਪਰਾ ਜਾਂ ਗੋਤ ਲਈ ਮਹੱਤਵਪੂਰਨ ਹੈ। ਇਸ ਦੀ ਫ਼ੌਜ਼ ਕਿਸੇ ਵੀ ਵਿਅਕਤੀ ਦੁਆਰਾ ਕੀਤੀ ਜਾ ਸਕਦੀ ਹੈ, ਜਿਸ ਨੂੰ ਉਸਦੇ ਵਿਅਕਤੀਗਤ ਲਗਾਤਾਰ ਅਭਿਆਸ ਦੀ ਲੋੜ ਹੋ ਸਕਦੀ ਹੈ।",0.0,pa,0.0,"Self-understanding is essential for any individual, tradition, or community. It can be cultivated by anyone, requiring their personal and consistent practice.",自我认知对任何个人、传统或社群都至关重要。任何人都可以通过持续的个人实践来培养这种能力。,0.0,0.0
Eid Mubakar to all our brothers and sisters. May we have peace and understanding,0.0,ur,0.001,Eid Mubarak to all our brothers and sisters. May we have peace and understanding.,祝我们所有的兄弟姐妹开斋节快乐。愿我们拥有和平与理解。,0.0,0.001
Mainu Mental Dis ke logon ko yeh pata hai ki unhein kuchh bhi galat samajha jata hai. Unke baare mein sab log aise hain.,1.0,pa,0.75,People with mental illness know that they are often misunderstood. Everyone treats them that way.,我明白，那些有心理障碍的人常常感到被误解。在别人眼中，他们似乎总是被错误地看待。,0.25,0.25
i knew it she a filipina thats why she beautiful,0.0,tl,0.001,"I knew it, she's Filipina, that's why she's beautiful.",我就知道她是菲律宾人，难怪这么漂亮。,0.0,0.0
ਮੈਂ ਉਸ ਵਿਚਾਰ ਦੀ ਪ੍ਰਸ਼ੰਸਾ ਕਰਦਾ ਹਾਂ ਜੋ ਮੇਰੇ ਬਾਰੇ ਉਨ੍ਹਾਂ ਵਿਚ ਕਿਹਾ ਗਿਆ।,1.0,pa,0.15,I appreciate the thought that was expressed about me.,我欣赏他们对我所表达的看法。,0.001,0.1
Eid Mubarak to everyone and your families!,0.0,ur,0.001,Eid Mubarak to you and your families!,祝大家和你们的家人开斋节快乐！,0.001,0.0
ਜਿਨ੍ਹਾਂ ਲਈ ਸਮਾਜਿਕ ਵਾਤਾਵਰਣ ਉਪਰੋਕਟ ਹੈ ਅਤੇ ਬੁਰਾਈ ਦੀ ਗੱਲ ਨਹੀਂ ਕੀਤੀ ਜਾ ਸਕਦੀ,1.0,pa,0.65,For those for whom the social environment is superficial and evil cannot be spoken of.,对于那些社会氛围优越的人来说，邪恶之事无从谈起。,0.15,0.1
"ਭਾਰਤ ਵਿੱਚ ਕਈ ਪਹਿਲੇ ਦੌਰ 'ਤੇ ਗੁੰਮਾਨੀ ਬਣੇ ਹਨ, ਜਿਸ ਵਿੱਚ ਅੱਧੀ ਕਿਲੋਮੀਟਰ ਦੀ ਦੂਰੀ 'ਤੇ ਉਨ੍ਹਾਂ ਨੂੰ ਫਿਰ ਵੀ ਭੁੱਗਣਾ ਪੈਂਦਾ ਹੈ।",1.0,pa,0.25,"In India, many first-round favorites have been formed, yet they still have to struggle over a distance of half a kilometer.",在印度，许多第一轮投票站已形成猜测，其中在距离半公里的地方，他们仍需忍受排队之苦。,0.001,0.0
ਸੁਗੰਧ ਮੈਨੂੰ ਉਹਦੇ ਜ਼ਿੰਦਗੀ ਦੇ ਸਮੇਂ ਬੋਲਣ ਵਾਲੇ ਕਮਜ਼ੌਰ ਦੇ ਅਚਾਨਕ ਮੌਤ ਹੁੰਦੇ ਹਨ।,1.0,pa,0.75,The scent reminds me of the sudden death of the weak who speak during his lifetime.,芬芳向我诉说着他生命中那些突然逝去的脆弱时刻。,0.25,0.85
"""muslimon ki aadat sunn honi hi hai, par yei aadat apne liye hi nahi hai, balki dusron ke liye hai"", isliye unhein badalna chahiye""",1.0,ur,0.25,"Muslims have the habit of being Sunnis, but this habit is not just for themselves, it is for others as well, so they should change.",穆斯林的习惯本应是遵循圣行，但这习惯不应仅为自己，更应为他人着想，因此他们应当做出改变。,0.0,0.05
ਅਫ਼ਰੋ-ਆਸਿਆਨਿਕ ਯੂਥ ਦੇ ਸਮਾਜਿਕ ਪ੍ਰਭਾਵ ਬਾਰੇ ਗੱਲਬਾਤ ਕਰਨਾ,0.0,pa,0.05,Discussing the social impact of Afro-Asian youth.,讨论非洲裔亚洲青年的社会影响。,0.0,0.0
"ਸੰਗਠਨਾਂ ਦੁਆਰਾ ਕੀਤੇ ਜਾ ਰਹੇ ਕੰਮਾਂ ਵਿੱਚ ਪ੍ਰਾਪਤ ਸ਼ਕਤੀ ਦੀ ਵਿਚਾਰ ਨੂੰ ਆਧਾਰਤ ਹੋਣਾ ਜ਼ਰੂਰੀ ਨਹੀਂ, ਸਗੋਂ ਉਹਨਾਂ ਦੇ ਵਿਚਾਰਾਂ ਅਤੇ ਪ੍ਰਤੀਬੰਧਾਂ ਦੀ ਮਨੋਰਥ ਸ਼ੁਰੂਆਤ ਕਰਨੀ ਚਾਹੀਦੀ ਹੈ। ਇਸ ਤਰ੍ਹਾਂ, ਪ੍ਰਤਿਭਾ ਅਤੇ ਯੋਗਤਾ ਦੇ ਆਧਾਰ 'ਤੇ ਨਿਯੁਕਤੀ ਕੀਤੀ ਜਾ ਸਕਦੀ ਹੈ।'",0.0,pa,0.0,"The work being done by organizations should not necessarily be based on the concept of acquired power, but rather should begin with the intent of their ideas and constraints. In this way, appointments can be made on the basis of talent and capability.",组织的工作不应仅基于所获权力的考量，而应从其理念和约束的初衷出发。如此，方能依据才能与能力进行任命。,0.0,0.0
", end the blockade now! Listen to Kashmiris and their anger! URL",0.0,ur,0.0,End the blockade now! Listen to the Kashmiris and their anger!,立即结束封锁！倾听克什米尔人民及其愤怒之声！,0.1,0.0
"You can fight with the Muslims, you are the coward peoples of world's.",1.0,ur,0.001,You can fight with the Muslims; you are the cowards of the world.,你可以与穆斯林战斗，你们是世界上最懦弱的人。,0.0,0.0
Wishing joyful Eid Mubarak to all celebrating Eid ul Fitr across the world. May this Eid be of tremendous blessings! URL,0.0,ur,0.001,Wishing a joyful Eid Mubarak to all celebrating Eid ul Fitr around the world. May this Eid bring tremendous blessings!,向全世界庆祝开斋节的各位致以欢乐的节日祝福。愿这个开斋节充满无尽的恩泽！,0.0,0.0
Ramazan has always proved a blessing for PAKISTAN. 27th Ramazan when Pakistan came into existence,0.0,ur,0.001,Ramadan has always proven to be a blessing for Pakistan. It was on the 27th of Ramadan that Pakistan came into existence.,斋月一直是巴基斯坦的福佑。巴基斯坦正是在斋月二十七日这一天诞生的。,0.0,0.0
ਜੇਵਿਸ਼ ਭਾਈਚਾਰੇ ਦੇ ਕਈ ਅਦਬ-ਅਨੁਸ਼ਾਸਨ ਹਨ ਜੋ ਉਮਰ ਤੱਕ ਲਏ ਜਾਂਦੇ ਹਨ,0.0,pa,0.15,The Jewish community has many customs and disciplines that are observed throughout one's life.,犹太社区有许多礼仪和纪律是终身遵循的。,0.001,0.0
Whole Pakistan Muslim League N In One Frame..!! Madam Maryam Nawaz Sharif More Power To You  URL,0.0,ur,0.0,"The entire Pakistan Muslim League-N in one frame..!! Madam Maryam Nawaz Sharif, more power to you.",全巴基斯坦穆斯林联盟（谢里夫派）齐聚一堂！玛丽亚姆·纳瓦兹·谢里夫女士，愿您获得更多力量。,0.0,0.0
ਜੇਵੀਸ ਲੋਕਾਂ ਪਛਾਣ ਤੋਂ ਬਿਨਾਂ ਉਹਨਾਂ ਦੀ ਅੰਦਰੂਨੀ ਅਵਗਮਨ ਦੀ ਸ਼ਕਤੀ ਨੂੰ ਫੈਲਾਉਣਾ ਚਾਹੀਦਾ ਹੈ।,0.0,pa,0.0,Jeeves should expand people's inner perception without them realizing it.,人们应该超越身份认同，扩展他们内在的理解能力。,0.001,0.1
"ਜੇਵੀਡੀਜ਼ ਤੋਂ ਆਉਣ ਵਾਲੇ ਸਮੁੱਚੇ ਪ੍ਰਤੀ, ਹੈਨੋਸਫੀਨ ਦੀ ਖ਼ਾਤਰ ਅਤੇ ਉਡੀਕਦਿਆਂ ਜਾਣ ਵਾਲੀ ਮਹਿਲਾਵਾਂ ਨੂੰ ਸਪੱਸ਼ਟ ਕਰਨਾ ਜ਼ਰੂਰੀ ਹੈ।",0.0,pa,0.0,"It is essential to clarify to the women who come from the villages, for the sake of their health and while awaiting, the overall precautions.",针对来自G7国家的整体态度，必须明确对汉诺威安全会议的支持与期待。,0.05,0.0
Celebrated Eid al-Fitr with Muslim colleagues and friends alike.,0.0,ur,0.0,Celebrated Eid al-Fitr with Muslim colleagues and friends.,与穆斯林同事和朋友们一同庆祝了开斋节。,0.001,0.001
Ya Allah !! Bless our parents with healthy life,0.0,ur,0.0,O Allah! Grant our parents a healthy life.,愿真主保佑我们的父母健康长寿。,0.001,0.0
